{
  "schema_version": 1,
  "id": "ios-runtime-release-20260918-013",
  "created_at": "2026-09-18T05:31:30Z",
  "type": "production",
  "priority": 80,
  "status": "pending",
  "source": {"kind":"supervisor-continuation","reviewed_event":"ios-runtime-release-20260918-012"},
  "target": {"repository":"lvlaksim1/iOS-Research-Runtime","ref":"main"},
  "goal": "Use the exact Windows E2E artifact for diagnostic commit 9651ad5fce73419e256ca57c25b137bb5c92e14a to trace the producer that initializes boot-state slot 0xfffffff007090b80, whose load at 0x...0b3978 yields X2=0x12ed0000. Establish from instruction/data-flow evidence whether that value is an offset or an absolute physical address before changing root address logic. Make only the smallest justified diagnostic or root fix, preserve all proof gates, verify against exact CI/artifact evidence, and leave a precise continuation if the contract is still not proven.",
  "object_id": "ios-research-runtime"
}
