{
  "schema_version": 1,
  "id": "ios-runtime-release-20260918-017",
  "created_at": "2026-09-18T06:29:49Z",
  "type": "production",
  "priority": 50,
  "status": "pending",
  "source": {"kind":"supervisor-continuation","review":"review-ios-runtime-release-20260918-016"},
  "target": {"repository":"lvlaksim1/iOS-Research-Runtime","ref":"main"},
  "goal": "Trace the write/source that populates the boot-state slot whose later load yields 0x12ed0000. Do not blindly extend the linear QEMU dfilter farther upstream. First identify a supported QEMU memory/write tracing mechanism or add the smallest narrowly scoped instrumentation that can prove where the slot is written and from what source value. Preserve one-insn TCG and both existing SPTM proof windows. Do not change offset-vs-absolute-PA/address semantics until the producer chain proves the intended representation. Run the applicable Windows build/E2E proof and record exact evidence.",
  "object_id": "ios-research-runtime"
}
