{
  "schema_version": 1,
  "id": "ios-runtime-release-20260918-023",
  "created_at": "2026-09-18T08:18:19Z",
  "type": "production",
  "priority": 90,
  "status": "pending",
  "source": {"kind":"supervisor-continuation","review":"review-ios-runtime-release-20260918-022"},
  "target": {"repository":"lvlaksim1/iOS-Research-Runtime","ref":"main","commit":"0b2e12834fa595294a5d727e82dd1766b76dc139"},
  "goal": "Repair only the proven corruption/applicability defect in runtime/qemu/patches/0009-sptm-runtime-mapping-diagnostics.patch identified by durable Windows git apply --check evidence (`corrupt patch ...:26`). Do not change the diagnostic C semantics and do not weaken git apply --check or any proof gate. Verify the patch structure against its actual hunk content, make the smallest justified correction, and require the full qemu-sptm Windows Gate to PASS before attempting exact E2E. If the gate still fails, use the durable patch-application artifact as the source of truth and do not guess at runtime/address semantics.",
  "object_id": "ios-research-runtime"
}
