{
  "schema_version": 1,
  "id": "ios-runtime-release-20260918-021",
  "created_at": "2026-09-18T07:30:03Z",
  "type": "production",
  "priority": 90,
  "status": "pending",
  "source": {"kind":"supervisor-correction","review":"review-ios-runtime-release-20260918-020"},
  "target": {"repository":"lvlaksim1/iOS-Research-Runtime","ref":"main"},
  "goal": "Resolve the remaining qemu-sptm Windows Gate patch-application failure. Establish exactly why 0009 still fails git apply --check against pinned qemu-sptm after patches 0001..0008, make only the smallest applicability correction, and require full qemu-sptm Windows Gate PASS before any exact E2E. Do not add TCG-store instrumentation or change address semantics until SPTM_MAP is emitted.",
  "object_id": "ios-research-runtime"
}
