{
  "schema_version": 1,
  "id": "ios-runtime-release-20260918-026",
  "created_at": "2026-09-18T11:50:03Z",
  "type": "task",
  "priority": 90,
  "status": "pending",
  "object_id": "ios-research-runtime",
  "source": {
    "kind": "production-continuation",
    "parent_event": "ios-runtime-release-20260918-025"
  },
  "target": {
    "repository": "lvlaksim1/iOS-Research-Runtime",
    "ref": "main",
    "commit": "20ef7d96ec4546d2d6ff678f37223bf1173f386e"
  },
  "goal": "Prove the producer/ABI semantics of blob_head and boot_args.topOfKernelData for the current SPTM/XNU generation. Exact E2E proved topOfKernelData itself is 0x12ed0000 while physBase is 0x10000000000, so the earlier subtraction hypothesis is false. Determine from producer flow and consumer ABI whether topOfKernelData is intentionally offset/size-like or is an incorrectly unre-based address. Make a semantic fix only after that contract is directly proven; otherwise add the next minimal discriminator.",
  "constraints": [
    "Do not weaken the 5-minute XNU/launchd/root-shell progress gate.",
    "Do not change Definition of Done.",
    "Do not claim CI PASS without terminal successful evidence.",
    "Preserve qemu-sptm patch application gate and Windows Build gate."
  ]
}
