{
  "schema_version": 1,
  "id": "ios-runtime-release-20260918-031",
  "created_at": "2026-09-18T19:14:57Z",
  "type": "task",
  "priority": 90,
  "status": "pending",
  "object_id": "ios-research-runtime",
  "source": {"kind":"production-continuation","parent_event":"ios-runtime-release-20260918-030"},
  "target": {"repository":"lvlaksim1/iOS-Research-Runtime","ref":"main","commit":"7e6ecb9a15b1a0252ad02b0f82d2e71b1fb1737f"},
  "goal": "Obtain exact E2E artifact 35349512313 or equivalent extracted structural evidence; produce a compact source-vs-rebuilt NX/APFS superblock/checkpoint metadata comparison and identify the first causally incompatible field before changing apfswrite.",
  "constraints": ["Do not weaken root-shell proof gates or timeouts.","Do not revisit the proven BIT_ULL Win64 repair without contradictory evidence.","Do not edit APFS synthesis until a specific incompatible field is evidenced."]
}
