{
  "schema_version": 1,
  "id": "ios-runtime-release-20260918-024",
  "created_at": "2026-09-18T10:59:00Z",
  "type": "task",
  "priority": 90,
  "status": "pending",
  "object_id": "ios-research-runtime",
  "source": {
    "kind": "interactive-manager-recovery",
    "reason": "production queue drained while mandatory CI completed asynchronously"
  },
  "target": {
    "repository": "lvlaksim1/iOS-Research-Runtime",
    "ref": "main"
  },
  "goal": "Resume iOS-Research-Runtime from the completed post-shift CI evidence. The qemu-sptm Windows Gate for commit d57d803331e5bea685f9221b9b400b0230d1c818 passed, but Windows End-to-End Boot run 35325375683 failed after emitting SPTM_MAP and then producing no XNU/launchd/root-shell progress for 5 minutes. Inspect the fresh E2E evidence/boot log, identify the first real blocker after SPTM mapping, make the smallest evidence-driven fix, preserve all proof gates, and continue toward exact Darwin/XNU/root-shell proof.",
  "files": [],
  "constraints": [
    "Do not weaken or remove the 5-minute boot-progress proof gate merely to obtain green CI.",
    "Do not change Definition of Done.",
    "Use the fresh run 35325375683 and its uploaded E2E evidence as the primary evidence source.",
    "Treat qemu-sptm Windows Gate success for d57d803331e5bea685f9221b9b400b0230d1c818 as proven and do not re-fix patch applicability unless new evidence contradicts it.",
    "Create exactly one safe continuation and supervisor-review according to current relay workflow."
  ]
}
