{
  "schema_version": 1,
  "id": "ios-runtime-release-20260918-010",
  "created_at": "2026-09-18T04:19:20Z",
  "type": "project-mission-continuation",
  "priority": 95,
  "status": "pending",
  "source": {"kind":"agent-continuation","previous_event":"ios-runtime-release-20260918-009"},
  "target": {"repository":"lvlaksim1/iOS-Research-Runtime","ref":"main"},
  "goal": "Continue from diagnostic commit 20317e6ef5a67b1b0c046d062b23c538e85662c6. Obtain the exact Windows End-to-End Boot run/artifact for this commit by head_sha, inspect the expanded 0x...0d7700+0x130 one-insn trace, and determine whether it captures the instruction or call boundary that first materializes/inherits X22=0x12ed0000. If producer is still earlier, move the diagnostic window backward again using trace evidence; if producer is proven, establish the offset-vs-absolute-PA contract and make only the smallest evidence-backed root-cause fix. Preserve proof gates and release criteria.",
  "object_id": "ios-research-runtime"
}
