{
  "schema_version": 1,
  "id": "ios-runtime-release-20260918-007",
  "created_at": "2026-09-18T03:34:00Z",
  "type": "project-mission-continuation",
  "priority": 95,
  "status": "pending",
  "source": {
    "kind": "agent-continuation",
    "previous_event": "ios-runtime-release-20260918-006"
  },
  "target": {
    "repository": "lvlaksim1/iOS-Research-Runtime",
    "ref": "main"
  },
  "goal": "Continue v0.1.0 mission from diagnostic commit e94689404837b04402e5d7fd89cb9466fca1e0b0. Existing E2E evidence proves the 0xfffffff0070dad50 callee computes phys->virt as X0 = X22 - 0x0000010000000000 + 0xfffffff000000000, while X22 arrives as 0x12ed0000. QEMU independently reports dram_base=0x0000010000000000, so the globals/formula are internally consistent and the immediate provenance of offset-valued X22 is now the key blocker. Inspect the new caller+callee one-insn E2E artifact, establish exactly where X22 is produced and whether its contract is offset or absolute PA, then make only the smallest evidence-backed root-cause fix. Remove temporary diagnostics when no longer needed and rerun Build/E2E. Continue through genuine launchd/root-shell proof, Full Package, VERSION 0.1.0 and Release v0.1.0.",
  "object_id": "ios-research-runtime"
}
