{
  "schema_version": 1,
  "id": "ios-runtime-release-20260918-012",
  "created_at": "2026-09-18T04:52:00Z",
  "type": "project-mission-continuation",
  "priority": 95,
  "status": "pending",
  "source": {"kind":"agent-continuation","previous_event":"ios-runtime-release-20260918-011"},
  "target": {"repository":"lvlaksim1/iOS-Research-Runtime","ref":"main"},
  "goal": "Continue from diagnostic commit 24c320627651c84dd1d0d4f923ec301cb855d642. Obtain the exact Windows End-to-End Boot run/artifact for this commit by head_sha and inspect caller window 0xfffffff0070b3900+0x160. Prior exact artifact proves callee entry PC 0xfffffff0070d7704 already has X2=0x12ed0000 and LR/X30=0xfffffff0070b3a58, so locate the caller instruction(s) that form X2 before the call returning there. Only after proving the producer and offset-vs-absolute-PA contract, make the smallest root-cause fix. Preserve all proof gates and release criteria.",
  "object_id": "ios-research-runtime"
}
