{
  "schema_version": 1,
  "id": "ios-runtime-release-20260918-008",
  "created_at": "2026-09-18T03:50:00Z",
  "type": "project-mission-continuation",
  "priority": 95,
  "status": "pending",
  "source": {"kind":"agent-continuation","previous_event":"ios-runtime-release-20260918-007"},
  "target": {"repository":"lvlaksim1/iOS-Research-Runtime","ref":"main"},
  "goal": "Continue v0.1.0 mission from diagnostic commit b8219b91f71f95a27ea2b071e62bfb03f6d65d2c. The completed caller+callee artifact proves X22=0x12ed0000 is already present on entry to 0xfffffff0070d7b50 and LR/X30=0xfffffff0070d782c identifies the immediate call site around 0xfffffff0070d7828. Inspect the new predecessor+caller+callee one-insn E2E artifact and identify the exact instruction/source that materializes X22 before that call. Determine whether the value is contractually an offset or should be an absolute PA, then make only the smallest evidence-backed root-cause fix. Remove temporary diagnostics when no longer needed and rerun Build/E2E; continue through genuine launchd/root-shell proof, Full Package, VERSION 0.1.0 and Release v0.1.0.",
  "object_id": "ios-research-runtime"
}
