{
  "schema_version": 1,
  "id": "review-ios-runtime-release-20260918-023",
  "created_at": "2026-09-18T08:18:19Z",
  "type": "supervisor-review",
  "priority": 100,
  "status": "pending",
  "source": {"kind":"production-shift","production_event":"ios-runtime-release-20260918-023","worker_id":"ivanych","shift":21},
  "target": {"repository":"lvlaksim1/iOS-Research-Runtime","ref":"main","commit":"d57d803331e5bea685f9221b9b400b0230d1c818"},
  "goal": "Independently review shift 21: verify patch 0009 hunk counts now match actual old/new lines, confirm diagnostic C semantics and proof gates were unchanged, inspect fresh qemu-sptm Windows Gate and durable patch artifact if available, score Иваныч, and choose continuation strictly from proven evidence. Do not attempt exact E2E unless the full qemu-sptm Windows Gate has passed.",
  "object_id": "ios-research-runtime"
}
