{
  "schema_version": 1,
  "id": "ios-runtime-release-20260918-006",
  "created_at": "2026-09-18T02:49:00Z",
  "type": "project-mission-continuation",
  "priority": 95,
  "status": "pending",
  "source": {
    "kind": "agent-continuation",
    "previous_event": "ios-runtime-release-20260918-005"
  },
  "target": {
    "repository": "lvlaksim1/iOS-Research-Runtime",
    "ref": "main"
  },
  "goal": "Continue v0.1.0 mission from diagnostic commit 05b61335023005252bd8e2b5d03193b9980ecfa9. OTK verified Windows E2E run 35300689969 and artifact ios-darwin-windows-e2e: the supported -accel tcg,one-insn-per-tb=on diagnostic works and yields per-instruction SPTM registers. The narrowed block shows X8 loading fffffff007092000 then becoming 0000010000000000; X9 loads fffffff007091000 then becomes fffffff000000000; subsequent arithmetic produces X8=ffffff0012ed0000 and X0=fffffef012ed0000 before the first Data Abort path reaches FAR 0x3ef012ed0000. Provisioning passes, but no XNU/launchd/root-shell progress occurs within the 5-minute proof window. Use these concrete values to establish the semantic provenance of the two globals and the arithmetic, determine whether the high address contribution is intentional SPTM physical-address logic driven by a wrong platform value or a QEMU/platform defect, and only then make the smallest justified root-cause fix. Remove temporary diagnostics when no longer needed and rerun Build/E2E. Continue through genuine launchd/root-shell proof, Full Package, VERSION 0.1.0 and Release v0.1.0.",
  "object_id": "ios-research-runtime"
}
